название вакансии,URL,Название компании,Описание
ИТ-Рекрутер,https://hh.ru/vacancy/31006135?query=Python, Рекадро,"Закрытие ИТ вакансий по различным направлениям (разработчики разного уровня, программисты C#, Java, Python, Golang). Поиск кандидатов на работных сайтах, в...Успешный опыт подбора IT-специалистов от 1 года и более (разработчики различного уровня). Умение использовать различные источники и методы оценки..."
Системный администратор,https://hh.ru/vacancy/29676236?query=Python, Panasonic,"Установка, настройка рабочих мест, обучение и консультация пользователей. Участие в инфраструктурных проектах. Настройка и поддержка серверного, сетевого оборудования и оргтехники. Знание языков программирования для автоматизации задач PowerShell, Python. Владение английским языком на уровне intermediate. Желание развиваться и получать новые навыки..."
Проектный менеджер (Департамент комплексной оценки рисков),https://hh.ru/vacancy/29118745?query=Python," «РОСБАНК, Societe Generale Group», с опытом работы","Построение математических моделей предсказания поведения клиентов (розничных и корпоративных), стресс-тестирования профиля рисков Банка/Группы. Мониторинг скоринговых карт. Знание специальных программ и языков программирования (SQL, R, Python, VBA), MS Office (Excel, Access, Word, PowerPoint). Наличие навыков владения ­­­­­­­­­­­­­­­­­­­­­­­­SAS..."
Администратор биллинговой системы,https://hh.ru/vacancy/30997474?query=Python, EASY4,"Администрирование биллинговой системы. Интеграция АСР с внешними сервисами и оборудованием. Настройка биллинговой системы. Написание вспомогательных скриптов для решение прикладных задач. Знание OC Linux, умение программировать под Linux (shell, perl, python, ruby и т.п.). Опыт работы с СУБД (MySQL, PostgreSQL..."
Ведущий аналитик,https://hh.ru/vacancy/31002295?query=Python, Сбербанк для экспертов,"Начать использовать модели искусственного интеллекта в процессах розничного кредитования. Использовать новые данные и инструменты в процессах X-Sell. Релевантный опыт участия в проектах с ИТ-составляющей в роли аналитика на интеграционных проектах в крупных банках, или крупных системных..."
Аналитик Сектор моделирования и прогнозирования рисков \ Risk analyst,https://hh.ru/vacancy/30588438?query=Python," ОТП Банк, АО (OTP bank)","Разработка различных моделей для оценки риска : behavioral score (поведенческий скоринг), profitability models (модели расчета доходности), expected collected amount (модели возвратов...Опыт работы от 1 года. Математическое моделирование, знание статистических пакетов, python. Знание методов машинного обучения. Желание развиваться, умение самостоятельно разбираться..."
Инженер технической поддержки,https://hh.ru/vacancy/30696386?query=Python,ООО Лаборатория Умного Вождения,"Техническая поддержка работоспособности коммутационного и серверного оборудования, а также облачных сервисов компании. Работа с системами мониторинга и оповещения, эскалация профильным...Опыт работы с Hyper-V / VMware. Знание скриптовых языков - Unix shell scripts (bash, sh, csh), cmd/bat, Python, знание основ..."
Архитектор логической модели данных,https://hh.ru/vacancy/29954364?query=Python,ПАО МТС,"Команда: нас уже 200, планируем вырасти до 300. Для работы над продуктом собираем команду из разных центров компетенций (их более......систем класса MDM. Опыт работы в agile командах. Умение читать код на одном из языков программирования: Java, PHP, С++, Python."
Главный специалист по конфигурированию систем информационной безопасности,https://hh.ru/vacancy/31000746?query=Python,ПАО Ростелеком,"Эксплуатация платформы SIEM, обеспечение отказоустойчивости ее функционирования, масштабирования(поддержка и тюнинг работы java, администрирование mysql/postgresql, работа с контейнерами). Опыт программирования на одном из языков (Python/Bash/PowerShell/Perl и т.д.) или опыт создания скриптов в рамках решения..."
Макроэкономист,https://hh.ru/vacancy/28962756?query=Python, Центральный Банк Российской Федерации,"Мониторинг, анализ, моделирование и прогнозирование показателей, характеризующих состояние внешних экономических условий, формирование и поддержание базы данных анализируемых показателей. Знание одного или нескольких языков программирования (Matlab, R, Python, Julia, SAS). Знание SQL и опыт работы с базами данных. "
Ведущий инженер,https://hh.ru/vacancy/30487645?query=Python,ПАО МТС,"Анализ и решение инцидентов с оборудованием. Общение с вендорами IBM, EMC-DELL, HP, MicroSoft, Oracle и RedHat. Поиск причин и...Продвинутый администратор. Читать и писать скрипты на BASH, SH, Perl, Python. 3. VmWare: Опыт управления сервисами IaaS, PaaS. "
Администратор учебного процесса в IT дополнительном образовании (пр-т Мира),https://hh.ru/vacancy/31006663?query=Python, ЧУ ДО Школа программистов,"Сопровождение образовательного процесса (консультирование родителей и учащихся по организационным вопросам, звонки с целью проверки удовлетворенности клиентов качеством сервиса и преподавания...Желательный опыт работы - в сфере дополнительного образования. Начинающий специалист с отличными коммуникативными навыками. Высокая клиентоориентированность. Грамотная устная и письменная речь. "
Методист (разработчик методических материалов младшей школы),https://hh.ru/vacancy/31006676?query=Python, ЧУ ДО Школа программистов,"Опыт преподавания у младших школьников в доп.образовании ИТ дисциплин, математики, алгоритмики, робототехники. Доп. образование ИТ\математика\техника для младших школьников. Наличие собственного портфолио метод. материалов для младших школьников (программа, поурочный план, набор заданий, методические указания для преподавателей). Знание возрастной специфики..."
Продуктовый аналитик (группа продуктового анализа),https://hh.ru/vacancy/31005935?query=Python,ПАО МТС,"Анализировать данные, строить и проверять гипотезы для улучшения продуктовых метрик. Делать это в тесной связи с продакт-менеджерами. Умение самостоятельно находить пути решения задачи. Способность работать в режиме многозадачности. Опыт работы с BI-инструментарием. Знание Python / R. "
Начальник аналитического управления,https://hh.ru/vacancy/30996004?query=Python, Страховая Компания Allianz,"Оперативный контроль и руководство деятельностью вверенного подразделения. Развитие продуктов. Разработка и внедрение инноваций, спецпредложений по ДМС и страхованию жизни. Знание алгоритмов машинного обучения, умение применять их в реальных задачах. Хорошее знание: Python, Excel, R, VBA программирование на уровне продвинутого..."
Администратор учебного процесса в IT (м. Парк-Культуры),https://hh.ru/vacancy/31006645?query=Python, ЧУ ДО Школа программистов,"Сопровождение образовательного процесса (консультирование родителей и учащихся по организационным вопросам, звонки с целью проверки удовлетворенности клиентов качеством сервиса и преподавания...Желательный опыт работы - в сфере дополнительного образования. Начинающий специалист с отличными коммуникативными навыками. Высокая клиентоориентированность. Грамотная устная и письменная речь. "
Руководитель направления,https://hh.ru/vacancy/31005010?query=Python, Сбербанк для экспертов,"Строить и дорабатывать модели для автоклассификации автоматизации поиска корневых причин, вызывающих обращения: определение интента, sentiment analysis. Внедрять разработанные модели в...Писать понятный рабочий код на python. быть знакомым c git, unittest. Работать с данными: numpy, pandas, SQL, json. "
Инженер технической поддержки,https://hh.ru/vacancy/30190792?query=Python,ООО Клауд Контакт,"Работа с клиентскими запросами, исследование заявленных проблем, устранение проблем своими средствами или с привлечением вендора. Точная диагностика причин возникновения проблем...Администрирование Windows Server, CentOs. Умение писать скрипты автоматизации (Python, Shell, Bash). Аккуратность и согласованность в действиях. Знание основ администрирование CISCO..."
Эксперт по работе с новыми данными (департамент розничных кредитных рисков),https://hh.ru/vacancy/29669483?query=Python, Банк ВТБ (ПАО),"Извлечение данных из корпоративного хранилища Банка в соответствии с запросами руководства, аналитиков, других контрагентов. Согласование экспертиз, спецификации для процессов, связанных...Высшее образование (техническое, математическое, экономическое). Знание основ математической статистики. Уверенное владение SQL, SAS Guide (желательно), SAS Miner (желательно), R, Hadoop..."
Главный специалист отдела анализа рыночных рисков,https://hh.ru/vacancy/30998238?query=Python,ПАО ТРАНСКАПИТАЛБАНК,"Анализ и оценка рыночных рисков и риска ликвидности. Стресс-тестирование рыночного риска. Подготовка управленческой отчетности по финансовым рискам. Знание английского языка на уровне чтения со словарем. Уверенный пользователь MS Offiсe, знание языков программирования (VBA, SQL, Python), знание Reuters..."
Методист отделений Проспект мира и Профсоюзная,https://hh.ru/vacancy/29491039?query=Python, ЧУ ДО Школа программистов,"Руководство деятельностью преподавателей, закрепленных за отделениями. Методические посещения и сопровождение учебного процесса. Развитие педагогических и предметных компетенций преподавателей. Собственный опыт преподавательской деятельности от 3 лет (IT - дисциплины) в учреждениях дополнительного образования. Опыт руководящей работы от 2-х лет..."
Руководитель группы прикладных администраторов,https://hh.ru/vacancy/31004146?query=Python, Сбербанк для экспертов,"Руководство группой администраторов прикладного уровня. Сопровождение промышленных банковских автоматизированных систем. Выстраивание процессов 2-линии поддержки. Повышение качества и надежности систем. Знание SQL. Знание модели OSI. Понимание работы JVM, J2EEБазовый уровень Python/Groovy. Понимание работы web-сервисов (REST, SOAP)."
Руководитель проекта Отдел риск-моделирования МСБ,https://hh.ru/vacancy/30992945?query=Python, Московский Кредитный Банк,"Подготовка и совершенствование аналитических отчетов о рисках кредитного портфеля розничного бизнеса и МСБ (в первую очередь гарантий участия в госзакупках). Работа в VBA будет плюсом. SAS, Python, R в части построения прогнозов и регрессий будет плюсом. Опыт работы с OLAP..."
Менеджер образовательных программ,https://hh.ru/vacancy/30992801?query=Python, Тинькофф,"Координирование и проведение программ стажировок. - Создание комфортных условий для студентов и менторов на всех этапах проведения стажировки: с момента сбора...Уверенное владение инструментами обработки большого количества информации (Excel как базовый инструмент, знание Python будет плюсом). После общения с заказчиками формируем..."
DevOps инженер,https://hh.ru/vacancy/30859947?query=Python, IBS,"Автоматизация процесса развертывания приложений в облачных средах, на базе продукта Arenadata Cluster Manager. Исследование работы приложений для больших данных в...Знание Linux на уровне начинающего сисадмина (apt/yum, iptables, nginx). Знание языков Bash/Python/Perl на уровне автоматизации процессов ОС. "
Системный инженер СУБД,https://hh.ru/vacancy/29392194?query=Python, IBS,"Внедрение СУБД Greenplum (MPP PostgreSQL) у заказчиков. Оказание техподдержки (2-3 линия) СУБД. Постановка задач для отдела разработки. Знание SQL. Знание как минимум одного скриптового языка из списка: Bash, Python. Уверенное знание Linux (RH 7 / CentOS 7)."
PHP developer (middle/senior),https://hh.ru/vacancy/27780132?query=Python, Туту.ру,"Проектировать, реализовывать новые сервисы и модули продуктов. Улучшать и оптимизировать уже существующие инструменты и активно участвовать во всём процессе разработки. Обязательно: Свободно мыслить и писать на PHP. Опыт с реляционными и нереляционными СУБД, а именно - MongoDB, PostgreSQL, в идеале и..."
