название вакансии,URL,Название компании,Описание
Руководитель направления (кредитные риски розничного бизнеса),https://hh.ru/vacancy/30408520?query=Python,АО Банк ДОМ.РФ,"Разработка/Review риск политик по новым/существующим кредитным продуктам с использованием информации из внутренних источников, БКИ, Телеком, интернет-источники, ритейлеры...Умение написания сложных запросов в SQL обязателен, опыт работы с использованием SAS или Python желательно. Владение аппаратом математической статистики, опыт..."
Разработчик ПО,https://hh.ru/vacancy/31000226?query=Python,ООО Прогматик Лаб,"Участие в разработках в среде OpenStack и Kubernetes для использования в различных деплойментах, включая доработку компонентов, окружающего инструментария и средств...Опыт разработки ПО или DevOps. Желателен опыт в: Ansible, Infrastructure deployment systems, Python, Docker, Kubernetes, Go, AWS EC2, VPC..."
R&D Architect,https://hh.ru/vacancy/31029892?query=Python, Инфосистемы Джет,"Разработка и проектирование инновационных продуктов в области высоконагруженных прикладных систем. Общение с Заказчиками, понимание их потребностей. Исследование конкурентных решений. ...усваивать новую информацию, ответственность и ориентированность на результат. Знание стека технологий (Java, Python, Linux, PostgreSQL, C++, Kotlin и т.д.)."
Разработчик С++,https://hh.ru/vacancy/23421630?query=Python, WayRay,"Разработка и поддержка C++ приложений. Разработка и поддержка unit и integration тестов, интеграция этих тестов в CI систему. Английский на уровне intermediate и выше. Опыт разработки приложений на Qt. Знание библиотек boost. Знание Python. Опыт работы с CMake. "
Помощник системного администратора в команду разработчиков САПР,https://hh.ru/vacancy/31026296?query=Python, CSoft Development,"Установка, настройка и поддержка работы виртуальных и физических серверов (LAMP, Postfix/Dovecot, MySQL, MSSQL, TeamCity, SVN, Active Directory). Навыки программирования на Perl/Shell/Python. Опыт автоматизации резервного копирования и репликации SQL серверов. Желание учиться и готовность занять позицию..."
Инженер по автоматизированному тестированию (QA Automation Engineer),https://hh.ru/vacancy/29565084?query=Python, WayRay,"Разработка сценариев тестирования программного обеспечения навигационных и IoT устройств. Ручное выполнение сценариев тестирования. Автоматизация сценариев тестирования. Запуск и разбор результатов...Владение linux shell, SQL, git, языком программирования Python. Знание принципов и методологий тестирования. Знание английского языка на уровне не ниже..."
Аналитик CRM,https://hh.ru/vacancy/27421414?query=Python,ПАО МТС,"Собирать и исследовать данные, структурировать их, проверять гипотезы, искать зависимости и аномалии. Работать с кластерным анализом - разделять клиентов на группы...Умение работать с большими объемами сырых данных. Навыки обработки данных в Python (знание pandas). Знание SQL. Аналитический склад ума. "
IT Lead (Digital Asset Risk Management / IS Security),https://hh.ru/vacancy/31028911?query=Python, Johnson & Johnson,"Serve as the primary ISRM DARM - point of contact for digital assets for specific EMEA-countries/clusters. Conduct pre-launch...Knowledge of Drupal. Knowledge of PHP, Python, Java, JavaScript, SQL, HTML5, and CSS3. Knowledge of Web Services technologies..."
Руководитель направления Data tools,https://hh.ru/vacancy/30995608?query=Python, Сбербанк для экспертов,"Анализ поведения клиентов, поиск причин и закономерностей в данных, проверка гипотез. Анализ эффективности банковских продуктов. Представление результатов анализа, оформление лаконичных...Высшее образование: математическое, ИТ, экономико-математическое. Продвинутый уровень SQL. Навыки программирования на Python. Навыки работы с инструментами BI (Qlik и..."
Senior SQA Engineer/SQA Engineer,https://hh.ru/vacancy/30392596?query=Python, Align Technology Inc,"API тестирование архитектуры REST. Проводить тестирование интеграции API с другими приложениями. Планировать работы по автоматизации тестирования. Делать рефакторинг и оптимизировать...Опыт работы от 1-3 года с языком программирования (Python/Java). Знания основных принципов архитектуры REST API, а также HTTP..."
Руководитель DevOps,https://hh.ru/vacancy/30994693?query=Python, Неофлекс,"Управление распределённой командой DevOps инженеров. Взаимодействие с заказчиками и подготовка технической экспертизы по проектам. Внедрение DevOps-практик в процесс разработки...Умение программировать на одном из скриптовых языков (например: Shell, Python). Навык деловой коммуникации с сотрудниками других подразделений и заказчиком. "
Главный инженер OpenStack,https://hh.ru/vacancy/30522288?query=Python, Ростелеком - Центры обработки данных,"Поддержка существующих инсталляций OpenStack и их развитие. Разработка механизмов и средств автоматизации жизненного цикла платформы, гипервизоров, ВМ. Внедрение методик CI...Опыт построения кластерных систем (например, Corosync, Pacemaker). Опыт написания скриптов и приложений на Python, Bash. Понимание концепции SDN. "
Системный инженер OpenStack,https://hh.ru/vacancy/30523064?query=Python, Ростелеком - Центры обработки данных,"Поддержка существующих инсталляций OpenStack и их развитие. Разработка механизмов и средств автоматизации жизненного цикла платформы, гипервизоров, ВМ. Внедрение методик CI...Опыт построения кластерных систем (например, Corosync, Pacemaker). Опыт написания скриптов и приложений на Python, Bash. Понимание концепции SDN. "
Quantitative Researcher Intern /стажер,https://hh.ru/vacancy/29951181?query=Python," Агентство 21 век, КЦ","Работа с большими и сложными наборами данных для построения количественных моделей, которые предсказывают будущие движения цен. Применение современных математических и......техника, экономика ведущих ВУЗов. Аспиранты. Уверенное владение английским языком. Навыки программирования на Python (numpy, sklearn, pandas, matplotlib и т. Д.)."
Старший инженер по физическому проектированию СБИС,https://hh.ru/vacancy/29680847?query=Python,АО НПЦ «ЭЛВИС»,Разработка топологии блоков и кристаллов СБИС. Логический синтез RTL. Внедрение DFT и Low Power.Знание подходов к Signoff STA. Понимание результатов временного анализа. Знание Tcl/Perl/Python/Shell для автоматизации задач. Опыт физической верификации. 
Инженер NMS/OSS,https://hh.ru/vacancy/31015599?query=Python, CPM,"Мониторинг, администрирование, установка, настройка, интеграция, поддержка, оптимизация работы систем, относящихся к категории NMS/OSS (Network Management System/Operational Support System...Опыт написания скриптов на Shell, Perl, Python. Знание SQL, PL/SQL, Oracle DB. Понимание основных бизнес- и технологических процессов телекоммуникационных..."
QA Team Lead,https://hh.ru/vacancy/30993489?query=Python,ОАО Дэшборд Системс,"Управление группой тестирования. Анализ требований. Создание тестовой документации. Распределение задач и контроль их исполнения. Взаимодействие с командой разработки. Опыт создания тестовой документации (тест планы, тест кейсы, чек-листы). Желателен опыт автоматизации на Python – Appium, Selenium. Опыт работы с..."
Инженер доступности сервисов/ SRE/ DevOps,https://hh.ru/vacancy/29765407?query=Python, Plazius,"Обеспечение высокой доступности продакшен среды и аптайма работающих там сервисов. Обеспечение масштабирования сервиса на аппаратном уровне и уровне системного ПО. Опыт эксплуатации нагруженных сервисов, работающих 24х7. Опыт программирования (bash, python, go, ruby, powershell или похожие). Опыт использования систем..."
Аналитик (Игры),https://hh.ru/vacancy/29895896?query=Python," Mail.Ru Group, Игры","Разработка и сопровождение систем и процессов анализа данных в студии, которые дают точное представление о том, как наши пользователи взаимодействуют...SQL, понимание построения баз данных, построение сложных запросов. Базовые знания Python или R для анализа данных (numpy/scipy/matplotlib/pandas). "
Продуктовый аналитик,https://hh.ru/vacancy/31018387?query=Python, Zoon.ru,"Оценивать продукты и фичи - как они работают и на что влияют. Проводить А/Б тесты - что стоит доработать, а что...Владение SQL. Знание систем веб-аналитики желательно. Плюсом будет, если вы владеете рhp или python, но это не обязательно."
Помощник аналитика,https://hh.ru/vacancy/31018575?query=Python, ПроКонтекст,"Обучаться в процессе работы. Сбор и обработка статистики. Пост-клик анализ. Проведение A/B тестов. Подготовка аналитических отчетов. Опыт работы с Google Data Studio/Microsoft Power BI. Знание языков JS/Python/PHP хотя бы начального уровня, желание обучаться..."
Инженер-программист DNS / Системный администратор FreeBSD,https://hh.ru/vacancy/30810801?query=Python," MSK-IX, Центр взаимодействия компьютерных сетей","Разработка модулей через API для серверов DNS (BIND, UNBOUND, PowerDNS, NSD). * Разработка модулей через API для PostgreSQL. O для интеграции...+ С/С++/Object С (очень желательно). + Python (желательно). + SQL (желательно). + BASH (желательно). + Perl (желательно). "
Quantitative Researcher/Intern,https://hh.ru/vacancy/30501513?query=Python," Агентство 21 век, КЦ","Работа с большими и сложными наборами данных для построения количественных моделей, которые предсказывают будущие движения цен. Применение современных математических и......студенты последних курсов. Уверенное владение английским языком. Высокий GPA. Навыки программирования на Python (numpy, sklearn, pandas, matplotlib и т. Д.)."
Администратор PostgreSQL,https://hh.ru/vacancy/29126747?query=Python, ФОРС,"Управление инфраструктурой Enterprise уровня (развертывание, настройка, поддержка системного и прикладного ПО) – 24\7. Поддержка доступности инфраструктурных сервисов компании. Навыки написания скриптов автоматизации с использованием : Bash,Python,Perl. Опыт администрирования СУБД Oracle 11/12. Опыт настройки и практического использования..."
Quantitative Researcher,https://hh.ru/vacancy/29958073?query=Python, WorldQuant,"Competitive financial rewards, based on performance and position. Job Responsibilities (including, but not limited to, the following): Building algorithmic, computer...Solid programming skills (C++ and/or Python). Good knowledge of English (both oral and written). Strong work ethic. "
QA-инженер WFM,https://hh.ru/vacancy/31001533?query=Python,ПАО МТС,"Проведение ручного и автоматизированного тестирования. Разработка и поддержание в актуальном состоянии тестовой документации. Анализ, систематизация и составление подробного описания найденных...Базовые знания технологий: SOAP, HTML, Java, XML/XLST, Json. Базовые знания Python. Знание различных инструментов автоматизации тестирования. Опыт работы с..."
Analyst and Reporting Specialist,https://hh.ru/vacancy/31023540?query=Python," adidas, Центральный офис","Analysis and processes modeling for Logistics department$. Logistics Volume plan-fact analysis, recommendations for achieving KPI’s in collaboration with...Experience of automation \ process optimization in the company. Work experience with BI-systems \ SQL DB \ Python \ EXASOL. Upper-Intermediate English."
Разработчик навигационных алгоритмов,https://hh.ru/vacancy/30129960?query=Python, WayRay,"Разработка алгоритмов определения позиции и ориентации автомобиля на основе данных с GNSS, IMU, видеокамеры и информации о движении с бортовой...Опыт программирования на C++ и Python (включая numpy, scipy, pandas, matplotlib). Базовые знания по Computer Science: понимание как устроены основные..."
"Преподаватель компьютерных/IT курсов, программирования, информатики, робототехники",https://hh.ru/vacancy/30137791?query=Python, ЧУ ДО Школа программистов,"Web-дизайн, CMS, PHP, JavaScript. Робототехника и микроконтроллеры. Системное администрирование. Компьютерные сети. Компьютерная графика, видеомонтаж и др. Что Вы будете...Вы обладаете опытом публичных выступлений. Получили или скоро получите техническое или педагогическое высшее образование. И/или направлений IT-технологий: Компьютерное..."
Системный администратор,https://hh.ru/vacancy/30871589?query=Python, СМ-Клиника,"Администрирование серверов на базе ОС Windows и Linux. Сопровождение и развитие распределенной сети на оборудовании Cisco. Администрирование СУБД MS SQL...Опыт настройки систем резервного копирования. Опыт работы с bash, python, powershell, vbs. Глубокие знания серверных ОС Linux, Windows и основных..."
Инженер-верификатор аналоговых блоков,https://hh.ru/vacancy/29685239?query=Python,АО НПЦ «ЭЛВИС»,"Разработка методик контроля характеристик аналоговых устройств и отдельных блоков на различных этапах разработки. Разработка схем тестовой оснастки в схемотехнических САПР. Базовое понимание принципов работы аналоговых схем (ВАХ, АЧХ, Шум, Линейность...). Знание одного из скриптовых языков (Ocean/SKILL или Python). "
DevOps specialist,https://hh.ru/vacancy/30033743?query=Python, Сибур,"Поддержка и развитие в части devops инфраструктуры (hadoop кластер и его компонеты, балансировщики, очереди, сервера приложений). Установка, настройка и администрирование...Знание скриптовых языков (Python, Bash, powershell). Опыт сборки и деплоя приложений, основной стек: Java, Scala, Python. Опыт работы с контейнерами..."
Support Engineer,https://hh.ru/vacancy/30506143?query=Python, АДВ,"Сопровождение: регистрация запросов пользователей, ответы на вопросы, консультации по различным вопросам работы системы, анализ и поиск решения проблем. Опыт написания SQL запросов. Опыт написания инструкций для пользователей. Знание одного из языков программирования (Java, Python, C#). Английский не ниже..."
Антифрод-аналитик,https://hh.ru/vacancy/30999576?query=Python," Mail.Ru Group, Решения для бизнеса","Управление антифрод-системой: создание правил, анализ эффективности их работы, адаптация к новым мошенническим схемам. Анализ большого объема данных пользователях и...Знание основ статистики, алгоритмов, умение программировать (предпочтительно Python). Знание SQL. Аналитические навыки, способность визуализировать данные, находить в них закономерности и..."
Разработчик 1С,https://hh.ru/vacancy/30096802?query=Python, 1service,"Устойчивость к процессным и организационным изменениям. Выделенная персональная машина для разработки (4Gb ОЗУ, SSD 250 Гб). Взаимодействие по задачам...Разработка с учётом будущих обновлений. Второй язык программирования (VB, JS, Python, oscript etc.) будет преимуществом. Понимание основ бухгалтерского и управленческого..."
Стажер в отдел аналитики (Business intelligence),https://hh.ru/vacancy/30987729?query=Python, Авито,"Строить модели поведения пользователей Авито, сегментировать их и выявлять потребности. Вместе с командой определять структуру метрик для оценки различных инициатив...Знаете разнообразные методики анализа данных. Умеете писать код на SQL/Python/R. Активные, коммуникабельные, не любите делать решения «в стол..."
Системный инженер,https://hh.ru/vacancy/30500520?query=Python, Почта России,"Разработка и актуализация технической архитектуры системы. Разработка/согласование технических спецификаций. Постановка задач на развертывание инфраструктуры. Проектирование систем технического мониторинга. Знание хотя бы одного функционального языка программирования для автоматизации тестирования (предпочтительно bash, python3). Уверенное знание систем багтрекинга (минимально Jira..."
Quantitative researcher,https://hh.ru/vacancy/31001628?query=Python, Cindicator,"Проведение количественных исследований для рынков криптовалют. Исследования и разработка торговых стратегий. Анализ микроструктуры рынка. Комплексная визуализация данных.Понимание основ линейной алгебры, статистики и эконометрики. Прикладные знания Python (pandas, numpy, plotting). Понимание объектно-ориентированного программирования. Письменный и разговорный..."
Продуктовый аналитик в сервис Яндекс.Еда,https://hh.ru/vacancy/30997589?query=Python, Яндекс,"Формулировать продуктовые гипотезы, проверять их, проводить эксперименты и делать выводы, которые окажут влияние на продукты. Изучать поведение пользователей, находить инсайты...Умеете писать SQL-запросы и программировать на Python (Pandas, NumPy, Matplotlib). Не боитесь осваивать новые технологии. Умеете видеть за числами..."
